key,en,bp,es,pt,de,fr,it,cs,pl,ru,ja,ko,TR,zh-CN,zh-TW,nl,el,no,ro,sv,uk,bg,fi,hu,daJournal_PoltergeistDesc,"One of the most famous Ghosts, a Poltergeist, also known as a noisy ghost can manipulate objects around it to spread fear into its victims.

Unique Strengths: A Poltergeist can throw huge amounts of objects at once.

Weaknesses: A Poltergeist is almost ineffective in an empty room.","Um dos mais famosos fantasmas, o Poltergeist, conhecido também por ser um fantasma barulhento, pode manipular objetos à sua volta para causar medo em suas vitimas

Pontos fortes: Um Poltergeist pode jogar grandes quantidades de objetos de uma vez só.

Fraquezas: Um Poltergeist quase não tem forças em uma sala vazia.","Uno de los tipos de fantasma más famosos: el poltergeist. También se le conoce por ser un fantasma muy ruidoso que puede manipular objetos a su alrededor para crear miedo sobre sus víctimas.

Fortalezas: Un poltergeist puede tirar un montón de objetos al mismo tiempo.

Debilidades: Un poltergeist es casi inútil en una sala vacía. ","Um dos Fantasmas mais famosos, um Poltergeist, também conhecido como fantasma barulhento, pode manipular objetos ao seu redor para espalhar o medo nas suas vítimas.

Únicos Pontos Fortes: Um Poltergeist pode lançar grandes quantidades de objetos de uma vez.

Fraquezas: Um Poltergeist é quase ineficaz em uma sala vazia.","Einer der berühmtesten Geister. Ein Poltergeist ist bekannt als ein Wesen das laut ist und Objekte um sich herum manipuliert, um seinen Opfern Angst einzujagen. 
 
 Stärken: Ein Poltergeist kann viele Objekte auf einmal werfen.
 
 Schwächen: Ein Poltergeist ist in einem leeren Raum fast ineffektiv.","L'un des fantômes les plus célèbres : le Poltergeist. Également connu sous le nom d'esprit frappeur, il peut manipuler les objets qui l'entourent pour semer la peur chez ses victimes.

Forces uniques: Un Poltergeist peut lancer d'énormes quantités d'objets à la fois.

Faiblesses: Un Poltergeist est presque inefficace dans une pièce vide.","Uno dei Fantasmi più famosi, il Poltergeist, noto anche come Fantasma rumoroso, può manipolare gli oggetti intorno ad esso per diffondere paura nelle sue vittime.

Punti di Forza: Il Poltergeist può lanciare una grossa quantità di oggetti in una sola volta.

Punti Deboli: Il Poltergeist è quasi inefficace in una stanza vuota.","Jeden z nejslavnějších duchů, Poltergeist, známý také jako hlučný duch, může manipulovat s objekty kolem sebe a šířit strach do svých obětí.

Unikátní síla: Poltergeist může házet obrovské množství předmětů najednou.

Slabiny: Poltergeist je v prázdné místnosti téměř neúčinný.","Jeden z najsłynniejszych rodzajów duchów, Poltergeist, znany również jako hałaśliwa istota, może manipulować obiektami wokół, aby wzbudzać strach w swoich ofiarach.

Wyjątkowa moc: Poltergeist może wchodzić w interakcję z dużą ilością przedmiotów naraz.

Słabości: Poltergeist jest mało skuteczny w pustych pomieszczeniach.","Полтергейст — один из самых известных призраков. Он может шуметь и взаимодействовать с окружающими объектами, чтобы вселять ужас в своих жертв.

Особые качества: Полтергейст способен швырять большое число предметов одновременно.

Слабые стороны: Полтергейст практически безоружен в пустой комнате.","物体に干渉する能力を持ち、恐慌状態をもたら
す比較的有名なゴースト。

特徴：
沢山の物を動かし、投げることが可能

弱点：
物が置いていない部屋ではほぼ無力になる","폴터가이스트는 주변 사물들을 조종하여 사람들을 공포에 떨게 하는 유령입니다.

특징: 많은 양의 물체를 한번에 던질 수 있습니다.

약점: 주변에 사물이 없으면 공격성이 저하됩니다.","Poltergeist, en ünlü hayaletlerden biri olarak ve aynı zamanda gürültülü bir hayalet olarak da bilinir, kurbanlarına korku yaymak için etrafındaki nesneleri manipüle edebilir.

Eşsiz Güçlü Yönler: Aynı anda büyük miktarda nesne fırlatabilir.

Zayıf Yönler: Boş bir odada neredeyse etkisizdir.","鬼魂中最著名的一种鬼，
也称为吵闹鬼。
他可以通过操纵周围的物体来散播恐惧。

特征：骚灵可以一次性投掷大量物体

弱点：骚灵在空无一物的房间内毫无用处","鬼魂中最著名的一種鬼，
也稱為吵鬧鬼。
他可以通過操縱周圍的物體來散播恐懼。
 
 特徵：騷靈可以一次性投擲大量物體
 
 弱點：騷靈在空無一物的房間內毫無用處","Een van de beroemdste geesten, een poltergeist, ook wel bekend als een luidruchtige geest, kan objecten om zichzelf heen manipuleren om angst bij zijn slachtoffers te zaaien.

Unieke sterke punten: een poltergeist kan enorme hoeveelheden objecten tegelijk gooien.

Zwakke punten: een poltergeist is bijna niet effectief in een lege kamer.","Ένα από τα πιο διάσημα φαντάσματα, είναι το Poltergeist, επίσης γνωστό ως θορυβώδες φάντασμα, μπορεί να χειριστεί αντικείμενα γύρω του για να τρομάξει τα θύματά του.

Μοναδικά δυνατά σημεία: Ο Poltergeist μπορεί να ρίξει πολλά αντικείμενα ταυτόχρονα.

Αδυναμίες:Ο Poltergeist δεν είναι ισχυρός σε ένα άδειο δωμάτιο.","En av de mest kjente spøkelser, en Poltergeist, også kjent som et bråkete spøkelse kan manipulere objekter rundt det å spre frykt i sine ofre.

Unike Styrker: En Poltergeist kan kaste store mengder objekter samtidig.

Svakheter: En Poltergeist er nesten ineffektive i et tomt rom.","Una dintre cele mai celebre fantome, un poltergeist, de asemenea cunoscut ca o fantomă zgomotoasă, poate manipula obiecte din jurul ei pentru a evoca frică în victimele sale.

Puncte forte: Un poltergeist poate arunca cantități uriașe de obiecte odată.

Puncte slabe: Un poltergeist este inutil într-o cameră fără obiecte","En av de mest kända spöken, en poltergeist, även känd som ett bullrigt spöke, kan manipulera föremål runt om den för att sprida rädsla i sina offer.

Unika styrkor: En poltergeist kan kasta enorma mängder föremål samtidigt.

Svagheter: En poltergeist är nästan helt oeffektiv i ett tomt rum.","Полтергейст (Poltergeist) - один з найвідоміших привидів. Він може шуміти й взаємодіяти з навколишніми об'єктами, щоб вселяти жах у своїх жертв.

Особливі якості: Полтергейст здатний жбурляти велике число предметів одночасно.

Слабкі сторони: Полтергейст практично безсильний в порожній кімнаті.","Един от най-известните Призраци, Полтъргайст, известен още като шумен призрак, може да манипулира предмети около себе си, за да разпространява страх сред жертвите си.

Уникални силни страни: Полтъргайст може да хвърля огромни количества предмети наведнъж.

Слаби страни: Полтъргейст е почти неефективен в празна стая.","Yksi kuuluisimmista aaveista, Räyhähenki, joka tunnetaan myös äänekkäänä aaveena, manipuloi esineitä ympärillään aiheuttaakseen pelkoa uhreissaan.

Uniikit vahvuudet: Räyhähenki voi heitellä suurta määrää esineitä samanaikaisesti.

Heikkoudet: Räyhähenki on lähes vaaraton tyhjässä huoneessa.
","Az egyik leghíresebb kísértet a kopogószellem, amely zajos szellemként ismert, mivel tárgyak dobálásával félemléti meg áldozatait.

Erősség: A kopogószellem képes egy időben több tárgy mozgatására.

Gyengeség: Majdhogynem hatástalan egy üres szobában.","En af de mest berømte spøgelser, en poltergeist, også kendt som et støjende spøgelse, kan manipulere objekter omkring det for at sprede frygt i sine ofre.

Unikke styrker: En poltergeist kan kaste store mængder objekter på én gang.

Svagheder: En poltergist er næsten ineffektiv i et tomt rum."
Journal_BansheeTitle,Banshee,Banshee,Banshee,Banshee,Banshee,Banshee,Banshee,Banshee,Banshee.,Банши,バンシー,밴시,Banshee,女妖,女妖,Banshee,Banshee,Banshee,Banshee.,Banshee,Банші,Банши,Banshee,Banshee,Banshee.
Journal_BansheeDesc,"A Banshee is a natural hunter and will attack anything. It has been known to stalk its prey one at a time until making its kill.

Unique Strengths: A Banshee will only target one person at a time.

Weaknesses: Banshees fear the Crucifix and will be less aggressive when near one.","Uma Banshee é uma caçadora natural que atacará qualquer um. É conhecida por perseguir suas presas, uma por uma, até matá-las.

Pontos fortes: Uma Banshee tem apenas um alvo por vez.

Fraquezas: As Banshees temem crucifixos e serão menos agressivas perto de um .","Una banshee es una cazadora nata y atacará a todo lo que esté a su alcance. Se las conoce por acechar a su presa individualmente hasta que la mata. 

Fortalezas: Una banshee solo atacará a una persona simultáneamente.

Debilidades: Las banshees tienen miedo de los crucifijos y serán menos agresivas cuando estén cerca de uno.","Um Banshee é um caçador natural e atacará qualquer coisa. Ele é conhecido por perseguir a sua presa até matá-la.

Únicos Pontos Fortes: Um Banshee terá como alvo apenas uma pessoa por vez.

Fraquezas: Os Banshees temem o Crucifixo e serão menos agressivos quando próximos a um.","Die Banshee ist ein Jäger und wird alles attackieren. Sie ist bekannt dafür, ihre Opfer zu stalken bis Sie jemanden tötet.
 
 Stärken: Eine Banshee wird jeweils nur eine Person jagen.
 
 Schwächen: Banshees fürchten das Kruzifix und sind weniger aggressiv in seinem Umkreis.","La Banshee est une chasseuse naturelle et attaquera n'importe quoi. Elle est connu pour traquer une personne à la fois jusqu'à ce qu'elle soit tuée.

Forces uniques: Une Banshee ne ciblera qu'une personne à la fois.

Faiblesses: Les Banshees craignent le Crucifix et seront moins agressives à proximité d'un.","La Banshee è una predatrice di natura che attacca qualsiasi cosa. 
È risaputo che insegue le prede una alla volta fino ad ucciderle.

Punti di Forza: La Banshee attacca solo una persona alla volta.

Punti Deboli: La Banshee teme il Crocifisso e sarà meno aggressiva vicino a uno di essi.","Banshee je přirozený lovec a zaútočí na cokoli. Je známo, že svou kořist pronásleduje, dokud ji nezabije.

Unikátní síla: Banshee bude cílit pouze na jednu osobu najednou.

Slabiny: Banshees se bojí Krucifixu a bude méně agresivní, když bude blízko nějakého.","Banshee jest urodzonym łowcą i zaatakuje wszystko, co stanie na jego drodze. Wiemy, że tropi tylko jedną ofiarę, aż do momentu, gdy ją zabije.

Wyjątkowa moc: Banshee skupia się tylko na jednej osobie.

Słabości: Lękiem Banshee jest Krucyfiks i będzie mniej agresywna w jego obecności.","Банши — природный хищник и может атаковать кого угодно. Известно, что банши будет целенаправленно преследовать свою избранную жертву, выжидая лучшего момента для нападения.

Особые качества: Банши будет фокусироваться на одном конкретном человеке.

Слабые стороны: Банши боятся распятия и будут менее агрессивны, если оно оставлено поблизости.","狙った獲物を執拗に付け狙う傾向があり、非常
に攻撃的なゴースト。

特徴：
特定のターゲットを一人ずつ狙う

弱点：
十字架を嫌い、その付近では攻撃性が低下する","밴시는 사냥감을 가리지 않으며, 한번 노린 사냥감을 죽일 때까지 스토킹합니다.

특징: 한번에 오직 한 사람만 노립니다.

약점: 십자가 근처에서 공격성이 저하됩니다.","Banshee doğal bir avcıdır ve her şeye saldırır. Avını öldürene kadar takip ettiği bilinmektedir.

Benzersiz Güçler: Bir seferde yalnızca bir kişiyi hedef alır.

Zayıf Yönler: Haç'tan korkar ve Haç'ın yanına yaklaştığında daha az saldırgan olur.","女妖是天生的猎人，
它会攻击任何东西。
它只会跟踪一个目标直至其死亡。

特征：一次只攻击一个人

弱点：害怕十字架","女妖是天生的獵人，
它會攻擊任何東西。
它只會跟蹤一個目標直至其死亡。
 
特徵：一次只攻擊一個人
 
弱點：害怕十字架","Een Banshee is een natuurlijke jager en zal alles aanvallen. Het is bekend dat een banshee zijn prooi één voor één achtervolgt tot het diegene doodt.

Unieke sterke punten: een Banshee richt zich slechts op één persoon tegelijk.

Zwakke punten: Banshees zijn bang voor kruisbeelden en daardoor ook minder aggresief rondom een kruisbeeld.","Ενα Banshee είναι φυσικοί κυνηγοί και θα επιτεθόυν σε οτιδιποτε. Είναι γνωστο οτι παρακολουθουν το θύμα τους ενα την φορα πριν το σκοτώσουν.

Μοναδικά δυνατά σημεία: Ένα Banshee θα στοχέυει μόνο ένα άτομο την φορά.

Αδυναμίες: Τα Banshee φοβούνται τον σταυρό, και θα είναι λιγότερο επιθετικά όταν είναι κοντά σε ένα.","En Banshee er en naturlig jeger og vil angripe noen. Den har vært kjent for å forfølge sitt bytte en om gangen for å drepe.

Unike Styrker: En Banshee vil bare målrette en person om gangen.

Svakheter: Banshees frykter krusifikset og vil være mindre aggressiv i nærheten av en.","Banshee este un vânător natural și va ataca orice. Acesta a fost cunoscut a-si prada ei unul cate unul.

Puncte forte: Banshee va vizita doar o singură persoană pe rand.

Puncte slabe: Banshees se tem crucifix și va fi mai puțin agresiv cu cat sunt mai aproape de unul.","En Banshee är en naturlig jägare och kommer att attackera vad som helst. De har varit kända att förfölja sitt byte ett i taget tills den dödar.

Unika styrkor: En Banshee riktar sig bara mot en person åt gången.

Svagheter: Banshees fruktar Krucifix och kommer att vara mindre aggressiva när de är nära en.","Банші (Banshee) - природний хижак, який здатний атакувати кого завгодно. Відомо, що Банші буде цілеспрямовано переслідувати свою обрану жертву, вичікуючи найкращого моменту для нападу.

Особливі якості: Банші буде фокусуватися на одній конкретній людині.

Слабкі сторони: Банші бояться розп'яття і будуть менш агресивні, якщо воно десь поблизу.","Банши е естествен ловец и ще атакува всичко. Известно е, че преследва плячката си една по една, докато не я убие.

Уникални силни страни: Banshee ще се насочва само към един човек наведнъж.

Слабости: Банши се страхуват от Разпятието и ще бъдат по-малко агресивни, когато са близо до него.","Banshee on luonnollinen saalistaja ja hyökkää minkä tahansa kimppuun. Sen tiedetään vainoavan uhrejansa yksi kerrallaan ennen tappavaa iskua.

Uniikit vahvuudet: Banshee vaanii vain yhtä henkilöä kerrallaan.

Heikkoudet: Bansheet pelkäävät krusifiksia ja ovat vähemmän aggressivisia sen lähellä.","A banshee egy született vadász, amely bármit képes megtámadni. Egyenként követi zsákmányát, amíg azt meg nem öli.

Erősség: Egyidőben csak egy célpontja van.

Gyengeség: A banshee fél a feszülettől és kevésbé agresszív, ha van egy a közelében.","En banshee er en naturlig jæger og vil angribe noget. Det har været kendt at stjæle sit bytte en ad gangen, indtil det gør sin dræbe.

Unikke styrker: En banshee vil kun målrette en person ad gangen.

Svagheder: Banshees frygter Crucifix og vil være mindre aggressiv, når den er tæt på en."
Journal_JinnTitle,Jinn,Jinn,Jinn,Jinn,Dschinn,Djinn,Jinn,Jinn,Jinn,Джинн,ジン,진,Jinn,巨灵,巨靈,Jinn,Jinn,Jinn,Jinn.,Jinn,Джин,Джин,Jinni,Jinn,Jinn.
