key,en,bp,es,pt,de,fr,it,cs,pl,ru,ja,ko,TR,zh-CN,zh-TW,nl,el,no,ro,sv,uk,bg,fi,hu,da
Splash_Headphones,For the best and most immersive experience please use Headphones and in game voice chat.,"Para uma melhor imersão e experiência, por favor use Fones de Ouvido e o canal de voz dentro do jogo.","Para experimentar la mayor inmersión, por favor, utiliza auriculares y el chat de voz integrado en el juego.","Para a melhor e mais envolvente experiência, por favor, use Fones de Ouvido e o canal de voz no jogo.",Für die beste und intensivste Erfahrung nutzen Sie bitte Kopfhörer und den In-Game Sprachchat.,"Pour une meilleure expérience immersive, nous vous recommandons d'utiliser un casque et le chat vocal en jeu.",Per un'esperienza migliore e più coinvolgente utilizza le cuffie e la chat vocale di gioco.,"
Pro maximální a všepohlcující zážitek doporučujeme použít sluchátka a zabudovaný hlasový chat.","Dla uzyskania najlepszych i najbardziej wciągających wrażeń, zalecamy używać słuchawek i czatu głosowego w grze.","Для погружения в атмосферу игры, используйте наушники и внутриигровой голосовой чат.","より臨場感を高める為に、
ヘッドフォンとゲーム内ボイスチャットの使用を推奨しています",몰입도를 높이기 위해 헤드폰 및 음성 채팅 사용을 권장합니다.,Daha iyi bir oyun tecrübesi için kulaklık ve mikrofon kullanın.,"请戴上耳机并使用游戏内的语音功能
以获得最佳的游戏体验。","請戴上耳機並使用遊戲內的語音功能
以獲得最佳的遊戲體驗。
（翻譯轉自簡體中文，未必完全正確）","Voor de beste en meest meeslepende ervaring, Gebruik een koptelefoon en praat in het spel.","Για την καλύτερη και πιο εντυπωσιακή εμπειρία, χρησιμοποιήστε ακουστικά και στο παιχνίδι φωνής παιχνιδιών.","For den beste opplevelsen av spillet, bruk hodetelefoner og den innebygde voicechat","Pentru cea mai plăcută și captivantă experiență, este recomandată folosirea căștilor și a voice chat-ului integrat.",För bäst upplevelse använd hörlurar och spel röstchatt,"Для найкращого ігрового досвіду, використовуйте навушники та внутрішньо ігровий голосовий чат.","За най-доброто и завладяващо изживяване, използвайте слушалки и в игралния гласов чат.",Käyttämällä kuulokkeita saat parhaan ja mukaansatempaavimman pelikokemuksen,A legjobb és leginkább magával ragadó élmény érdekében használd a fejhallgatód és a játékon belüli csevegést.,For den beste oplevelse brug høretelefoner og brug mikrofonen i spillet.
Splash_VoiceRecognition,Phasmophobia uses voice recognition. Please set your default windows microphone to the microphone you want to use.,"Phasmophobia utiliza do reconhecimento de voz. Por favor, ajuste o microfone padrão desejado.","
Phasmophobia utiliza el reconocimiento de voz. 
Por favor, asigna tu micrófono predeterminado de Windows al micrófono que quieres utilizar.","Phasmophobia usa reconhecimento de voz. Por favor, defina o microfone padrão do windows para o microfone que deseja usar.","Phasmophobia benutzt Spracherkennung. Bitte legen Sie das Mikrofon als Standard in Windows fest, das Sie benutzen möchten.",Phasmophobia utilise la reconnaissance vocale. Définissez votre périph. de communication par défaut sur le microphone que vous utilisez.,Phasmophobia utilizza il riconoscimento vocale. Imposta il microfono principale di Windows come microfono che vuoi usare.,"Hra Phasmophobia používá rozpoznávání hlasu. Nastavte výchozí mikrofon systému Windows na mikrofon, který chcete použít.","Phasmophobia wykorzystuje system rozpoznawania głosu. Ustaw domyślny mikrofon systemu Windows na mikrofon, którego chcesz używać.",Примечание: распознавание речи теперь доступно и на русском языке.,"本作は音声認識機能を使用しています
Windows内で使用しているマイクを設定してください",Phasmophobia는 음성 인식을 사용합니다. 사용하려는 기본 마이크를 설정하십시오.,Phasmophobia ses tanıma kullanır. Bunun için windowstan konuşma ayarlarınızı ingilizce olarak ayarlamalısınız.,"Phasmophobia使用语音识别功能。
请将您的默认Windows麦克风
设置你想要使用的麦克风。","Phasmophobia使用語音辨識功能。
請將您的預設Windows麥克風
設置你想要使用的麥克風。",Phasmophobia maakt gebruik van spraakherkenning. Stel uw standaard Windows-microfoon in op de microfoon die u wilt gebruiken.,Το Phasmophobia χρησιμοποιεί αναγνώριση φωνής. Ορίστε το προεπιλεγμένο μικρόφωνο Windows στο μικρόφωνο που θέλετε να χρησιμοποιήσετε.,Phasmophobia bruker stemmestyring. Pass på at du har satt opp rett mikrofon.,Phasmophobia folosește recunoaștere vocală. Vă rugăm folosiți microfonul dvs. implicit.,Phasmophobia använder röstigenkänning. Ställ in din standard Windows-mikrofon på den mikrofon du vill använda.,Примітка: розпізнавання мовлення доступне українською мовою.,"Phasmophobia използва гласово разпознаване. Моля, задайте вашия микрофон по подразбиране, който искате да използвате.",Phasmophobia käyttää äänentunnistusta. Muista vaihtaa windowsin oletusmikrofonisi käyttämääsi mikrofoniin,"A Phasmophobia beszédfelismerést használ. Kérlek állítsd be Windows alapértelmezettként azt a mikrofont, amelyiket használni szeretnéd.",Phasmophobia bruger stemme genkendelse. Venligst sæt din standard Windows mikrofon til den mikrofon du vil bruge.
Menu_ServerLobby,Play,Jogar,Jugar,Jogar,Spielen,Jouer,Gioca,Začít hrát,Graj,Играть,プレイ,게임 시작,Oyna,开始游戏,開始遊戲,Spelen,Παίξε,Spill,Joacă,Spela,Грати,Играта,Pelaa,Játék,Spil
Menu_Tutorial,Training,Treinamento,Entrenamiento,Treino,Training,Entraînement,Addestramento,Výcvik,Trening,Обучение,トレーニング,튜토리얼,Eğitim,训练,訓練,Training,Εκπαίδευση,Opplæring,Instruire,Träning,Навчання,Обучение,Harjoittele,Kiképzés,Træning
Menu_Store,Item Store,Loja,Tienda,Loja,Ausrüstung kaufen,Magasin,Negozio,Obchod,Sklep,Магазин,ストア,장비 상점,Ekipman Mağazası,物品商店,物品商店,Uitrusting winkel,Κατάστημα Αντικειμένων ,Butikk,Magazin de echipament,Butik,Магазин,Магазин,Kauppa,Felszerelésbolt,Vare butik
Menu_Options,Options,Opções,Opciones,Opções,Optionen,Options,Opzioni,Možnosti,Opcje,Параметры,設定,옵션,Seçenekler,选项,選項,Opties,Ρυθμίσεις,Alternativer,Opțiuni,Inställningar,Налаштування,Настройки,Asetukset,Beállítások,Indstillinger 
Menu_QuitGame,Quit Game,Sair,Salir del juego,Sair do Jogo,Spiel verlassen,Quitter le jeu,Esci,Ukončit hru,Opuść grę,Выйти из игры,終了,게임 종료,Oyundan Çık,退出游戏,退出遊戲,Spel sluiten,Έξοδος,Avslutt Spillet,Părăsește jocul,Avsluta Spelet,Вийти з гри,Напусни,Lopeta peli,Kilépés,Afslut spil
Menu_Experience,EXP Needed,EXP Necessária,Experiencia necesaria,EXP Necessária,Benötigte EXP,Exp nécessaire,EXP Necessaria,Potřebné EXP,Następny poziom,До следующего уровня:,必要経験値,남은 경험치,Gereken Tecrübe (exp),升级所需经验,升級所需經驗,EXP nodig ,Εμπειρία Που Απαιτείται,EXP Mangler,Puncte de experiență necesare,EXP behövs,Необхідно досвіду,Нужно EXP,Vaadittava EXP,Következő szinthez,Mangledne EXP
Menu_PlayerStats,Player Stats,Estatísticas do Jogador,Estadísticas del jugador,Estatísticas do Jogador,Spieler-Statistik,Statistiques du joueur,Statistiche Giocatore,Statistiky hráče,Statystyki gracza,Статистика игрока,プレイヤーステータス,플레이어 통계,Oyuncu istatistikleri,玩家数据,玩家數據,Spelersstatistieken,Στατιστικά παίκτη,Spiller Statestikk,Statisticile jucătorului,Spelarstatistik,Статистика гравця,Статистика на играча,Pelaajan tilastot,Játékos statisztikái,Spiller Statistik
Menu_Stats,Stats,Estatísticas,Estadísticas,Estatísticas,Informationen,Statistiques,Statistiche,Statistiky,Statystyki,Статистика,ステータス,진척도,İstatistikler,统计,統計,Statistieken,Στατιστικά,Status,Statistici,Statistik,Статистика,Статистика,Tilastot,Statisztikák,Statistik
Menu_DailyChallenges,Daily Challenges,Desafios diários,Desafíos diarios,Desafios Diários,Tägliche Herausforderungen,Défis quotidiens,Sfide Giornaliere,Denní výzvy,Wyzwania dnia,Ежедневные задания,デイリーチャレンジ,일일 미션,Günlük Görevler,每日挑战,每日挑戰,Dagelijkse uitdagingen,Ημερήσιες Προκλήσεις,Daglige Utfordringer,Provocări zilnice,Dagliga utmaningar,Щоденні завдання,Ежедневните предизвикателства,Päivittäiset haasteet,Napi kihívások,Daglige udfordringer
Menu_Money,Money,Dinheiro,Dinero,Dinheiro,Geld,Argent,Soldi,Peníze,Pieniądze,Деньги,所持金,돈,Para,金钱,金錢,Geld,Χρήματα,Saldo,Bani,Pengar,Гроші,Пари,Raha,Pénz,Penge
Menu_LanguageTitle,Select Language,Selecione o idioma,Seleccionar idioma,Selecione o Idioma,Sprache auswählen,Choisir la langue,Seleziona la tua lingua,Výběr jazyka,Wybór języka,Язык,言語選択,언어 선택,Dil Seçin,选择语言,選擇語言,Taal selecteren,Επιλέξτε Γλώσσα,Velg Språk,Selectează limba,Välj språk,Вибрати мову,Избери език,Valitse kieli,Nyelvválasztás,Vælg sprog
Menu_PhotoSensitivityWarningTitle,Photosensitivity Warning,Aviso de Fotossensibilidade,Advertencia sobre los ataques de fotosensibilidad,Aviso de Fotossensibilidade,Photosensitive Anfälle – Warnung,Avertissement relatif aux crises d'épilepsie photosensibles,Avviso Fotosensibilità,Varování fotosenzitivity,Ostrzeżenie o nadwrażliwości na światło,Предупреждение о светочувствительности,光過敏性発作に関する注意,감광성 경고,UYARI,光敏性癫痫警告,光敏性癲癇警告,Lichtgevoeligheids waarschuwing,Προειδοποίηση Φωτοευαισθησίας,Fotosensitivitet Advarsel,Pericol de epilepsie,Ljuskänslighets varning,"
Попередження про світлочутливість",Фоточувствително Предупреждение,Varoitus valoyliherkkyydestä,Fényérzékenység- és epilepsziaveszély!,Fotosensitiv Advarsel
Menu_PhotoSensitivityWarningMessage,"This Game contains Flashing Lights.

A very small percentage of people may experience a seizure when exposed to certain visual images, including flashing lights or patterns that may appear in video games. Even people who have no history of seizures or epilepsy may have an undiagnosed condition that can cause these “photosensitive epileptic seizures” while playing video games.

Immediately stop playing and consult a doctor if you experience any symptoms.","Este jogo contém Fortes Estímulos luminosos.

Uma pequena porcentagem das pessoas podem ter uma convulsão quando exposta a certos estímulos visuais, incluindo luzes piscando ou padrões que podem aparecer em videogames. Mesmo as pessoas sem histórico de ataques ou epilepsia podem ter uma condição não diagnosticada que pode causar essas “crises epilépticas fotossensíveis” ao jogar alguns tipos de jogos, fique alerta.

Pare imediatamente de jogar e consulte um médico se você sentir quaisquer sintomas anormais.","Este juego contiene luces intermitentes.

Un porcentaje muy pequeño de personas pueden padecer ataques cuando se exponen a ciertas imágenes visuales, incluidas luces intermitentes, patrones regulares o patrones móviles regulares que pueden aparecer en los videojuegos. 

Incluso las personas sin antecedentes de ataques o epilepsia pueden padecer enfermedades no diagnosticadas que puedan provocar estos ""ataques epilépticos por fotosensibilidad"" mientras juega.

Deje de jugar inmediatamente y consulte con su médico si experimenta cualquier síntoma.","Este Jogo contém Luzes Fortes.

Uma percentagem muito pequena de pessoas pode ter uma convulsão quando exposta a certas imagens visuais, incluindo luzes fortes ou padrões que podem aparecer em videogames. Mesmo pessoas que não têm histórico de ataques ou epilepsia podem ter uma condição não diagnosticada que pode causar essas “crises epilépticas fotossensíveis” ao jogar videogame.

Pare de jogar imediatamente e consulte um médico se sentir algum sintoma.","Dieses Spiel enthält flackernde Lichter.
 
 Bei einem sehr kleinen Prozentsatz von Menschen können Anfälle auftreten, wenn sie bestimmten visuellen Reizen ausgesetzt sind,
  z. B. Aufblitzenden Lichtern oder Mustern, die in Videospielen vorkommen. Auch Menschen ohne Vorgeschichte von Anfällen
  oder Epilepsie können ein nicht diagnostiziertes Leiden haben, das beim Abspielen von Videospielen zu diesen „fotosensitiven epileptischen Anfällen“ führt.
 
 Stellen Sie eines dieser Symptome bei sich fest, beenden Sie sofort das Spiel und suchen Sie einen Arzt auf.","Ce jeu contient des lumières clignotantes.

Un faible pourcentage de personnes peut avoir une crise d'épilepsie lorsqu'elles s'exposent à certaines images visuelles, notamment des voyants ou des motifs clignotants qui s'affichent dans les jeux vidéo. Les personnes qui n'ont jamais eu de crise d'épilepsie peuvent également être sujets à des « crises d'épilepsie photosensibles » en jouant à des jeux vidéo.

Cessez de jouer immédiatement et consultez un médecin si vous souffrez de l'un de ces symptômes.","Questo gioco contiene luci intermittenti. 

A una piccola percentuale di utenti potrebbero insorgere disturbi dovuti all'esposizione di alcune immagini, inclusi motivi o luci intermittenti che potrebbero apparire nei videogiochi. Anche le persone che non hanno mai sperimentato convulsioni o epilessia potrebbero avere una condizione non diagnosticata che può causare questi “attacchi di epilessia fotosensibile” durante la riproduzione di videogiochi. 

Smetti di giocare immediatamente e consulta un medico se si verificano i sintomi.","Tato hra obsahuje blikající světla. 

Velmi malé procento lidí může prožít záchvat, když jsou vystaveni určitým vizuálním jevům, pohledům na blikající světla, nebo vzory, objevující se ve videohrách. Dokonce i lidé, kteří dosud neprožili žádné záchvaty nebo epilepsii, mohou mít nediagnostikované onemocnění, které může způsobit tyto „fotosenzitivní epileptické záchvaty“ při hraní videoher. 

Okamžitě přestaňte hrát hru a navštivte lékaře, pokud se u vás vyskytnou nějaké příznaky.","Ta gra zawiera migające światła.

Bardzo niewielki odsetek ludzi może doświadczyć ataku podczas oglądania pewnych obrazów wizualnych, w tym migających świateł lub wzorów, które mogą pojawiać się w grach wideo. Nawet osoby, które nie miały historii napadów padaczkowych lub epilepsji, mogą mieć niezdiagnozowaną chorobę, która może powodować te „światłoczułe napady padaczkowe” podczas grania w gry wideo.

W przypadku wystąpienia jakichkolwiek objawów natychmiast przerwij grę i skonsultuj się z lekarzem.","В игре присутствуют вспышки яркого света.

Небольшой процент людей подвержен появлению приступов при воздействии определенных визуальных стимулов, к примеру, вспышек света или узоров, присутствующих в компьютерной игре. Эпилептические припадки могут возникать даже у людей, не испытывавших ранее подобных приступов.

При появлении симптомов, немедленно прекратите игру и проконсультируйтесь с врачом.","一部、強い光や模様の点滅などの演出があります。
光に敏感な方は目眩がしたり、体調が悪くなる恐れがあります。
万が一身体に異常を感じた場合は、すぐにゲームを中止し医師に相談してください。","이 게임의 일부 이용자는 간질 혹은 발작 이력이 없더라도 특정 광원, 패턴 혹은 이미지에 노출될 경우 발작 증상을 경험할 수 있습니다.","Bu oyun, aniden yanıp sönen ışıklar içermektedir. 

İnsanların çok küçük bir yüzdesi, video oyunlarında görünebilen yanıp sönen ışıklara veya desenlere maruz kaldıklarında epilepsi nöbeti geçirebilirler. Geçmişte epilepsi nöbeti geçirmemiş veya epilepsi geçmişi olmayan kişilerin bile, video oyunlarını oynarken bu epilepsi nöbetlerine neden olabilecek teşhis edilmemiş rahatsızlıkları olabilir.  

Herhangi bir belirtiyle karşılaşırsanız derhâl oyunu oynamayı bırakın ve bir doktora başvurun! ","这款游戏里会有闪烁的灯光。

极小部分人可能会在看到特定视觉图像（包括可能出现在电子游戏中的闪烁效果或图案）时出现癫痫症状。
甚至没有癫痫史的人也可能会在玩电子游戏时引发“光敏性癫痫发作”的未确诊症状。

如果您出现任何症状，请立即停止玩游戏并咨询医生。","這款遊戲裡會有閃爍的燈光。
 
極小部分人可能會在看到特定視覺圖像（包括可能出現在電子遊戲中的閃爍效果或圖案）時出現癲癇症狀。
甚至沒有癲癇史的人也可能會在玩電子遊戲時引發“光敏性癲癇發作”的未確診症狀。
 
如果您出現任何症狀，請立即停止玩遊戲並諮詢醫生。","Dit spel bevat flikkerende lichten.

Bij een zeer klein percentage personen kan een epileptische aanval optreden wanneer zij worden blootgesteld aan bepaalde visuele beelden, waaronder lichtflitsen of bepaalde patronen die kunnen verschijnen in video games. Zelfs mensen die geen geschiedenis van aanvallen of epilepsie kunnen niet gediagnosticeerd zijn en kunnen nog steeds epileptische aanvallen krijgen van het spelen van video spellen.

Stop onmiddelijk met spelen en raadpleeg een dokter als je deze symptonen meemaakt.","""Αυτό το παιχνίδι περιέχει φώτα που αναβοσβήνουν.

Ένα πολύ μικρό ποσοστό ανθρώπων μπορεί να βιώσει κρίσεις όταν εκτίθεται σε ορισμένες εικόνες, όπως φώτα που αναβοσβήνουν ή μοτίβα που ενδέχεται να εμφανιστούν σε βιντεοπαιχνίδια. Ακόμα και τα άτομα που δεν έχουν ιστορικό κρίσεων ή επιληψίας μπορεί να έχουν μια μη διαγνωσμένη πάθηση η οποία μπορεί να προκαλέσει “φωτοευαίσθητες επιληπτικές κρίσεις“ ενώ παίζετε βιντεοπαιχνίδια.

Σταματήστε αμέσως να παίζετε και συμβουλευτείτε αμέσως έναν ιατρό εάν εμφανίσετε συμπτώματα.""","Dette spillet inneholder blinkende lys.

En veldig liten prosentandel av mennesker kan oppleve et anfall når de blir utsatt for visse visuelle bilder, inkludert blinkende lys eller mønstre som kan vises i videospill. Selv personer som ikke har hatt kramper eller epilepsi, kan ha en udiagnostisert tilstand som kan forårsake disse ""lysfølsomme epileptiske anfallene"" mens de spiller videospill.

Slutt å spille umiddelbart og kontakt lege hvis du opplever symptomer!","""Acest joc conține lumini intermitente.

Un procent foarte mic de persoane ar putea suferi o criză atunci când sunt expuse la anumite imagini vizuale, inclusiv lumini sau modele care pot apărea în jocurile video intermitent. Chiar și oamenii care nu au antecedente de convulsii sau epilepsie pot avea o stare nediagnosticată care poate provoca aceste „crize epileptice“, în timp ce joacă jocuri video.

Imediat opriți-vă din a juca și consultați un medic dacă aveți orice simptome.""","Det här spelet innehåller blinkande lampor.

En mycket liten andel av människor kan drabbas av anfall när de utsätts för vissa visuella bilder, inklusive blinkande ljus eller mönster som kan förekomma i videospel. Även personer som inte har någon historia av krampanfall eller epilepsi kan ha ett odiagnostiserad tillstånd som kan orsaka dessa ”epileptiska anfall” när du spelar videospel.

Sluta omedelbart att spela och kontakta en läkare om du upplever några symptom.","У цій грі присутні сцени з мерехтливими вогнями.

Невеликий відсоток людей може зазнати епілептичного нападу від впливу візуальних зображень, мерехтливих вогнів або візерунків, які можуть з'являтися у відеоіграх. Епілептичний напад також може з'являтися у людей, які не зазнавали його до цього.

При появі симптомів, негайно припиніть гру і зверніться до лікаря.","Тази игра съдържа мигащи светлини.

Много малък процент от хората могат да получат припадък, когато са изложени на определени визуални изображения, включително мигащи светлини или шарки, които могат да се появят във видеоигрите. Дори хора, които нямат история със гърчове или епилепсия, могат да имат недиагностицирано състояние, което може да причини тези „фоточувствителни епилептични гърчове“, докато играят видео игри.

Веднага спрете да играете и се консултирайте с лекар, ако имате някакви симптоми.","
Tämä peli sisältää välkkyviä valoja. 

Pieni osa henkilöistä saattaa kokea epileptisiä kohtauksia altistuttuaan tietyille visuaalisille asioille, kuten välkkyville valoille tai kuvioille, jotka saattavat ilmaantua videopeleissä. Myös ihmisillä, joilla ei ole historiaa kohtauksista tai epilepsiasta saattaa olla diagnosoimaton terveydentila, joka voi aiheuttaa ""valoherkän epileptisen kohtauksen"". 

Jos huomaat epilepsian oireita, lopeta pelaaminen heti ja ota yhteyttä lääkäriin.","A játék villogó fényeket tartalmaz!

Bizonyos emberek rohamokat élhetnek át, ha villodzó fényeket vagy mintákat látnak a videójátékokban.
Még olyan embereknél is fennáll ennek a veszélye, akik nincsenek diagnosztizálva epilepsziával vagy más rohamot okozó betegséggel.

Ha bármilyen tünetet észlelsz, hagyd abba a játékot és fordulj orvoshoz!","Dette spil inholder blikende lys.

En meget lille procentdel af mennesker kan opleve et anfald når de udsættes for visse billeder, dette inkludere blinkende lys eller mønstre der måske bliver vist i spil. Selv personer uden historik af anfald eller epilepsi har måske en udiagnosticeret tilstand der kan skabe disse “Fotosensitiv epileptiske anfald” mens de spiller spil.

Straks stop med at spille og konsulter en læge, hvis du oplever nogen former af symptomer."
