key,en,bp,es,pt,de,fr,it,cs,pl,ru,ja,ko,TR,zh-CN,zh-TW,nl,el,no,ro,sv,uk,bg,fi,hu,daEquipmentDesc_Crucifix,A Crucifix is used to stop Ghosts from entering their physical form to attack you. It's advised to place them near the Ghost.,Um Crucifixo é usado para impedir que Fantasmas entrem em sua forma física para atacar você. É aconselhável colocá-lo perto do Fantasma.,Un crucifijo se utiliza para evitar que los fanstasmas se materialicen para atacarte. Se aconseja dejarlo cerca de la zona en la que aparece el fantasma.,Um Crucifixo é usado para impedir que Fantasmas entrem na sua forma física para atacar você. É aconselhável colocá-los perto do Fantasma.,"Ein Kruzifix wird dazu verwendet um die Geister daran zu hindern in Ihre physische Form zu wechseln und Sie anzugreifen. Es wird geraten, sie in der Nähe des Geistes abzulegen.",Un crucifix est utilisé pour empêcher les fantômes de prendre forme physique pour vous attaquer. Il est conseillé de les placer près du fantôme.,Il Crocifisso viene usato per impedire ai fantasmi di materializzarsi e attaccarti. È consigliato posizionarlo vicino al fantasma.,"Krucifix se používá k zabránění Duchům převzít jejich fyzickou podobu, aby na vás mohli zaútočit. Je doporučeno jej umístit v blízkosti Ducha.",Krucyfiks jest używany żeby zatrzymać duchy przed wejściem w ich fizyczną formę uniemożliwiając im atak. Zalecane jest położenie go niedaleko ducha.,"Распятие используется, чтобы призрак не мог обрести физическую форму и атаковать вас. Их советуется бросать на пол возле призрака.","十字架はその周囲におけるゴー
ストの具現化を妨害し、一時
的に非活性化させる力を秘めて
いる。
事前に任意の場所に設置しなけ
れば効果は得られない。",유령이 근처에 있을 때 내려놓아 사용할 수 있습니다. 내려놓은 동안 유령이 공격하기 위해 모습을 드러내지 않습니다.,"Haç, hayaletlerin size saldırmak için fizikler formlarına girmelerini engellemek için kullanılır. Hayaletlerin yakınına yerleştirilmesi tavsiye edilir.","十字架可用于防止鬼魂
化为物理形态来攻击你。","十字架可用於防止鬼魂
化為物理形態來攻擊你。",Een Kruisbeeld wordt gebruikt om te voorkomen dat geesten hun fysieke vorm binnenkomen om jou aan te vallen. Het wordt aangeraden om ze in de buurt van de geest neer te leggen.,Ο σταυρός χρησιμοποιείτε στο να σταματήσεις τα φαντάσματα απτο να εισέλθουν στην φυσική τους μορφή για να σου επιτεθούν. Συνιστάται να τους τοποθετείτε κοντά στα φαντάσματα.,En krusifiks hindrer spøkelser og innta fysisk form å jakte deg. Det er lurt å plassere den nær spøkelset.,Un crucifix este folosit pentru a opri o fantomă a intra în forma lor fizică și de a te ataca. Este recomandat să fie plasat în locul unde apare fantoma.,Ett Krucifix används för att hindra spöken från att kunna ta sina fysiska former för att attackera dig. Det rekommenderas placera dom nära spöket.,"Розп'яття використовується, щоб привид не міг знайти фізичну форму й атакувати вас. Подейкують, що його потрібно кидати на підлогу поруч з привидом.","Разпятие се използва, за да спре Духовете да влязат във физическата си форма, за да ви атакуват. Препоръчително е да ги поставите близо до Призрака.",Krusifiksia käytetään estämään aaveita astumaan fyysisiin muotoihinsa hyökätäkseen sinun kimppuusi. Se kannattaa pitää lähellä aavetta.,"A feszület megakadályozza a kísérteteket attól, hogy testet öltsenek és megtámadjanak. Érdemes a szellem közelében letenni.",Et kors bliver brugt til at stopper spøgelset for at gå i fysisk form til at angribe dig. Det rådes at placeres tæt på spøgelset.
EquipmentDesc_VideoCamera,This DSLR Camera has been fine tuned to take videos of the paranormal. The camera has a live feed to your base of operations.,Esta câmera DSLR foi ajustada para gravar vídeos do paranormal. A câmera possui um envio ao vivo para sua base de operações.,"Esta cámara de vídeo ha sido perfilada para grabar lo paranormal. La cámara está vinculada al monitor del camión, en tu base de operaciones.",Esta câmera DSLR foi ajustada para gravar vídeos do paranormal. A câmera tem uma transmissão ao vivo para a sua base de operações.,"Diese DSLR-Kamera wurde modifiziert, damit Sie Videos der paranormalen Aktivitäten machen können. Sie verfügt über einen Live-Feed im LKW.",Cet appareil photo à reflex numérique a été mis au point pour prendre des vidéos du paranormal. L'image est retransmise en direct à votre base d'opérations..,Questa Videocamera reflex digitale è stata messa a punto per riuscire a catturare video di eventi paranormali. Dispone di collegamento in diretta con la base.,"Tato DSLR videokamera byla vyladěna tak, aby dokázala pořídit záznam nadpřirozena. Videokamera vše přenáší živě do vaší základny operací.",Ta kamera DSLR została dostrojona do robienia filmów paranormalnych. Kamera transmituje na żywo do mobilnej bazy operacyjnej.,Эта DSLR-камера предназначена для видеосъемки паранормальных явлений. Полученное видео транслируется на монитор в вашем фургоне.,"このデジタル一眼レフカメラは
超常現象を録画できるように特
殊な改造が施されている。
トラックのモニターへのライブ
配信機能付き。",초자연적인 현상을 담을 수 있는 비디오 카메라입니다. 작전 트럭의 모니터에서 실시간으로 확인할 수 있습니다.,Bu DSLR fotoğraf makinesinin hassasiyeti paranormal olayları çekebilmek için ayarlandı. Ayrıca bu kamera ile kamyona canlı yayın yapabilirsiniz.,"这个改装过的数码单反相机
可以拍摄出超自然现象的视频。
摄像模式会实时记录你的行动。","這個改裝過的數碼單反相機
可以拍攝出超自然現象的視頻。
攝像模式會即時記錄你的行動。",Deze DSLR-camera is nauwkeurig afgesteld om video's van het paranormale te maken. De DSLR-Camera heeft een live feed naar uw truck.,Αυτή η κάμερα έχει προσαρμοστεί στο να τραβάει φωτογραφίες των παραφυσικών. Αυτό θα σε βοηθήσει σε περίπτωση που χρειάζονται περισσότερες αποδείξεις,Dette DSLR kameraet er spesial tilpasset for å ta video av det paranormale. Bruk det sammen med skjermen i lastebilen.,Acest aparat DSLR a fost reglat pentru a înregistra video activitatea paranormală. Camera are un feed direct la baza ta de operații.,Denna DSLR Kamera har blivit finsjusterad till att spela in videos på det paranormala. Denna kamera sänder direkt till basen för din verksamhet.,Ця DSLR-камера призначена для відеозйомки паранормальних явищ. Отримане відео транслюється на монітор у вашому фургоні.,Тази DSLR камера е прецизно настроена да прави видеоклипове на паранормалното. Камерата има емисия на живо към вашата база от операции.,Tämä DSLR-kamera on hienosäädetty tallentamaan videokuvaa paranormaaleista ilmiöistä. Kamerakuva välitetään auton toimintakeskukseen.,"A videókamera finomhangolva lett arra, hogy lencsevégre kapja a szellemeket. Élőben sugározza vissza a jelet a teherautóba.",Dette DSLR-kamera har været fint indstillet til at tage videoer af den paranormale. Kameraet har et levende foder til din base af operationer.
EquipmentDesc_SpiritBox,This electronic voice phenomenon recorder or Spirit Box can capture paranormal radio frequencies that can allow communication with spirits.,Este gravador de fenômeno de voz eletrônico ou Spirit Box pode capturar frequências de rádio paranormais que podem permitir a comunicação com espíritos.,Esta grabadora de voces paranormales (también llamada Spirit Box) puede capturar frecuencias de radio paranormales que permiten la comunicación con los espíritus.,Este gravador eletrônico de fenômeno de voz ou Caixa de Espírito pode capturar frequências de rádio paranormais que podem permitir a comunicação com espíritos.,"Dieser elektronische Stimmen-Phänomen-Recorder oder auch Geisterbox gennant, kann paranormale Funkfrequenzen erfassen, die es Ihnen erlaubt mit den Geistern zu kommunizieren.",Cet enregistreur de phénomène vocal électronique ou Spirit Box peut capturer des fréquences radio paranormales qui peuvent permettre la communication avec les esprits.,Questa Spirit Box è in grado di catturare le frequenze radio paranormali che possono consentire la comunicazione con gli spiriti.,"Tento záznamník elektronických hlasových jevů, neboli Spirit Box, dokáže zachytit paranormální rádiové frekvence, které mohou umožnit komunikaci s duchy.","Ten elektroniczny rejestrator zjawisk głosowych (Spirit Box) może przechwytywać paranormalne częstotliwości radiowe, które umożliwiają komunikację z duchami.",Радиоприёмник позволяет засечь проявления электронного голосового феномена и позволит вам общаться с призраками.,"電子音声現象レコーダー、通称
「スピリットボックス」はゴー
ストの発する特殊な周波数を検
知することができ、音声での交
信を可能にする。",주파수를 포착하여 유령과 소통할 수 있도록 해줍니다.,"Bu elektronik ses fenomeni kaydedici veya ruh telsizi, ruhlarla iletişime izin verebilecek paranormal radyo frekanslarını yakalayabilir.","通灵盒可以捕捉超自然无线电频率，
并用于与鬼魂交流。","通靈盒可以捕捉超自然無線電頻率，
用於與鬼魂交流。",Deze Elektronische Stemfenomeenrecorder of EVP-radio kan paranormale radiofrequenties vastleggen die communicatie met geesten mogelijk maken.,Αυτό το ηλεκτρονικό όργανο καταγραφής φαινόμενων φωνής ή Ραδιόφωνο μπορεί να συλλάβει τις παραφυσικές ραδιοσυχνότητες που μπορούν να επιτρέψουν την επικοινωνία με τα πνεύματα.,En Spirit Box kan fange paranormale radiofrekvenser som gjør at du kan prate med spøkelser.,Acest dispozitiv de înregistrare de fenomen audio sau Spirit Box poate captura frecvențe radio paranormale care poate permite comunicarea cu spiritele.,Denna elektroniska röstfenomen inspelare eller spök låda kan fånga paranormala radiofrekvenser vilket tillåter kommunikationer med andar.,Радіоприймач дозволяє засікти прояви електронного голосового феномена і дозволить вам спілкуватися з привидами.,"Този електронен рекордер за гласов феномен или Spirit Box може да улавя паранормални радиочестоти, които могат да позволят комуникация с духове.","Tämä elektroninen ääni-ilmiöiden tallennin, henkiradio, pystyy tallentamaan paranormaaleja radiotaajuuksia, jotka saattavat mahdollistaa aaveiden kanssa kommunikoinnin.","A Spirit Box rádiófrekvenciákon keresztül teszi lehetővé, hogy lelkekkel tudjunk beszélni.","Denne elektroniske stemmefænomenoptager eller åndsboks kan fange paranormale radiofrekvenser, der kan tillade kommunikation med spiritus."
EquipmentDesc_Salt,Salt is toxic to most kinds of Ghosts and will reveal their footsteps under a UV light.,O sal é tóxico para todos os tipos de fantasmas e revela seus passos sob uma luz UV.,La sal es tóxica para la mayoría de fantasmas y revelerá sus pisadas cuando se examine con una linterna ultravioleta.,O Sal é tóxico para a maioria dos Fantasmas e revela os seus passos sob a Luz UV.,Salz ist giftig für alle Arten von Geistern und wird ihre Fußspuren unter UV-Licht preisgeben.,Le sel est toxique pour toutes sortes de fantômes et révélera leurs pas sous une lumière UV.,Il Sale è tossico per la maggior parte dei tipi di fantasmi e rivelerà le loro orme sotto una luce UV.,Sůl je toxická pro většinu druhů Duchů a odhalí jejich stopy pod UV světlem.,Sól jest toksyczna dla większości duchów i pomaga ujawnić ich ślady w świetle UV.,"Соль токсична для большинства призраков, а подсветив рассыпанную соль УФ-фонариком, вы сможете увидеть следы перемещений призрака.","塩は多くのゴーストに有害な効
果をもたらすと言われている。
UVライトでゴーストの足跡を浮
かび上がらせることができる。",소금은 대부분의 유령에게 치명적입니다. 자외선 라이트와 함께 사용하여 유령의 발자국을 볼 수 있습니다.,"Tuz, çoğu Hayalet türü için zehirlidir ve UV ışığı altında ayak seslerini ortaya çıkaracaktır.","盐会与大多数鬼魂起反应并留下足迹。
用紫外线手电筒可以照射出足迹。","鹽會與大多數鬼魂起反應並留下足跡。
用紫外線手電筒可以照射出足跡。",Zout is giftig voor de meeste soorten geesten en zal hun voetstappen laten zien onder een UV-licht.,Το αλάτι είναι τοξικό στα περισσότερα είδη φαντασμάτων και θα αποκαλύψει τα βήματα τους κάτω απο ένα UV Light,Salt er giftig for de fleste typer spøkelser. Du kan finne fotspor i saltet med UV-lys.,Sarea este toxică pentru cele mai multe tipuri de fantome și va dezvălui urmele lor sub o lumină UV.,Salt är giftigt för de flesta typer av Spöken och kommer visa deras fotsteg under UV Ljus,"Сіль токсична для більшості привидів, а підсвітивши розсипану сіль УФ-ліхтариком, ви зможете побачити сліди переміщень привидів.",Солта е токсична за повечето видове Призраци и ще разкрие стъпките им под UV светлина.,Suola on myrkyllistä suurimmalle osalle aaveista ja se paljastaa niiden jalanjäljet UV-valon alla.,"A legtöbb szellemre nézve a só mérgező, ha rálépnek, nyomot hagynak benne.",Salt er giftigt for de fleste slags spøgelser og vil afsløre deres fodspor under et UV-lys.
EquipmentDesc_Sage,Burning Smudge Sticks near a Ghost will prevent it from attacking for a period of time.,Queimar um Incenso é uma das formas básicas de defesa contra os tipos mais comuns de Fantasmas além de impedi-lo de atacar por um período de tempo.,Encender el incienso cerca de un fantasma evitará que el fantasma pueda atacarte durante un período determinado de tiempo.,Queimar Paus de Incenso perto de um Fantasma irá impedi-lo de atacar por um período de tempo.,Das verbrennen von Räucherstäbchen in der Nähe der Geister wird sie eine gewisse Zeitlang abhalten Sie anzugreifen.,Brûler des bâtons d'encens près d'un fantôme l'empêchera d'attaquer pendant un certain temps.,Accendere l'incenso in prossimità di un fantasma gli impedirà di attaccare per un periodo di tempo.,Pálení vykuřovadla v blízkosti Ducha zabrání jeho útoku po určitou dobu.,Zapalenie kadzidła w pobliżu ducha uniemożliwi mu atakowanie przez pewien czas.,"Если зажечь благовоние возле призрака, он не сможет атаковать вас в течение некоторого времени.","薬草を束ねた儀式用のお香。
ゴーストの近くで燃やすことに
より、一定時間攻撃を防ぐこと
が出来る。",정화 향초를 태워 짧은 시간 동안 유령에게 공격 받는 것을 막을 수 있습니다.,"Bir hayaletin yakınında tütsü yakmak, onun saldırmasını bir süreliğine engelleyecektir.",在鬼附近点燃圣木可在一段时间内阻止鬼魂攻击你。,在鬼附近點燃聖木可在一段時間內阻止鬼魂攻擊你。,"Door SmudgeSticks in de buurt van een geest te verbranden, kan het gedurende een bepaalde tijd niet aanvallen.",Καίγοντας Θυμιατό κοντά σε ένα φάντασμα θα το αποτρέψουν από το να επιτεθεί για μια συγκεκριμένη χρονική περίοδο,Å brenne Tørket Salvie i nærheten av et spøkelse vil hindre den fra å angripe for en periode.,Arderea tămâiei lângă o fantomă o va împiedica să atace pentru o perioadă de timp.,Att bränna rökelsebuketter nära ett spöke kommer hindra det från att attackera under en tidsperoid.,"Якщо запалити пахощі біля привида, він не зможе атакувати вас протягом деякого часу.",Изгарянето на Smudge Sticks близо до призрак ще му попречи да атакува за определен период от време.,Polttamalla suitsuketta aaveen lähellä voit tilapäisesti estää sitä hyökkäämästä kimppuusi..,A meggyújtott füstölő megakadályozza egy rövid ideig a közelben lévő kísértet támadását.,Burning Smudge Sticks nær et spøgelse forhindrer det i at angribe i en periode.
EquipmentDesc_Tripod,A Tripod can be used to mount Video Cameras on.,Um tripé pode ser usado para montar câmeras de vídeo.,El trípode puede ser usado para montar las cámaras de vídeo.,Um Tripé pode ser usado para montar Câmeras de Vídeo.,Mit einem Stativ können Ausrüstungsgegenstände wie Bewegungssensoren oder Videokameras auf erhöhter Position frei im Raum platziert werden.,Un trépied peut être utilisé pour monter des caméras vidéo dessus.,Un Treppiede che può essere usato per montarci sopra una videocamera.,Stativ je možné použít k přichycení videokamer.,Statyw może być stosowany do montowania na nim kamer.,На штатив можно поместить видеокамеру.,"ビデオカメラを取り付け、自立
させることができる三脚。",비디오 카메라를 올려놓을 때 사용합니다.,Tripot video kameraları sabitlemek için kullanılır.,三脚架可用于放置摄像机。,三腳架可用於放置攝像機。,Een Statief kan worden gebruikt om Videocamera's op te monteren.,Ένα τρίποδο μπορεί να χρησιμοποιηθεί για να τοποθετήσετε βίντεο κάμερες.,En tripod kan brukes sammen med Videokamera.,Un trepied poate fi folosit pentru montarea unei camere video.,Ett Stativ kan användas till att montera en kamera på.,На штатив можна помістити відеокамеру.,За монтиране на видеокамери може да се използва статив.,Kolmijalka johon voi jalustaa videokameran.,Az állványra a videókamerát lehet felrakni.,Et stativ kan bruges til at montere videokameraer på.
EquipmentDesc_StrongFlashlight,An upgraded version of the flashlight. Designed to help you in large areas when the lights go out.,Uma versão atualizada da lanterna. Projetado para ajudá-lo em grandes áreas quando as luzes se apagam.,Una versión mejorada de la linterna convencional. Diseñada para ofrecer más potencia lumínica en sitios grandes.,Uma versão atualizada da lanterna. Projetada para ajudá-lo em grandes áreas quando as luzes se apagam.,"Eine verbesserte Version der Taschenlampe, entwickelt um Ihnen in größeren Bereichen zu helfen, wenn die Lichter aus sind.",Une version améliorée de la lampe de poche. Conçu pour vous aider dans de grandes zones lorsque les lumières s'éteignent.,Una versione potenziata della torcia. Progettata per aiutare nelle grandi aree in assenza di luce.,"Vylepšená verze baterky. Navržena tak, aby vám pomohla v rozsáhlých oblastech, když zhasnou světla.","Ulepszona wersja latarki zaprojektowana tak, aby pomóc w dużych obszarach, gdy zgasną światła.",Улучшенная версия обычного фонарика способна осветить большую территорию в отсутствие света.,"より強力な光を発する懐中電灯。
暗闇の中でより広範囲を照らす
ことができる。",보다 넓은 지역을 밝혀주는 손전등입니다.,"Güçlü el feneri ışıklar söndüğünde, büyük odalarda size avandaj sağlar.",升级版的手电筒，可以照亮更大的区域。,升級版的手電筒，可以照亮更大的區域。,Een verbeterde versie van de Zaklamp. Ontworpen om u te helpen in grote ruimtes wanneer de lichten uitgaan.,Μια αναβαθμισμένη έκδοση του φακού. Σχεδιασμένο για να σας βοηθήσει σε μεγάλες περιοχές όταν σβήνουν τα φώτα.,En kraftigere lommelykt som kan hjelpe deg når du ikke har annet lys.,"O versiune imbunătățită a lanternei. Conceput pentru a vă ajuta în zone mari, când se stinge lumina.","En uppgraderad version av ficklampan, designad till att hjälpa dig i stora områden när strömmen går.","Покращена версія звичайного ліхтарика, здатна освітити велику територію під час відсутності світла.","Подобрена версия на фенерчето. Създаденa да ви помогне в големи площи, когато светлините угаснат.",Paranneltu versio taskulampusta. Tarkoitettu auttamaan sinua isoilla alueilla kun valot sammuvat.,A zseblámpa erősített változata; használatával nagyobb helyeket tudsz megvilágítani.,"En opgraderet version af lommelygten. Designet til at hjælpe dig i store områder, når lysene går ud."
